{
  "schema_version": "1.0.0",
  "session_id": "fixture-dock-1",
  "dock_profile": "software_emulated",
  "power_negotiated": false,
  "display_handoff": false,
  "continuity_ok": true,
  "evidence_class": "software",
  "collected_at_utc": "2026-08-07T00:00:00Z",
  "notes": "deterministic dock fixture"
}
